14:32:44.463902 nsw49-adsl-062.tpgi.com.au.ssh > 10.163.111.203.syd.ntt.net.au.3745: P 92199732:92199796(64) ack 3927629284 win 17152 (DF) [tos 0x10] 
14:32:44.694103 f411.mail.yahoo.com.www > nsw49-adsl-062.tpgi.com.au.1049: . 377315598:377317058(1460) ack 2688788 win 8760 (DF)
14:32:44.747050 f411.mail.yahoo.com.www > nsw49-adsl-062.tpgi.com.au.1049: . 1460:2920(1460) ack 1 win 8760 (DF)
14:32:44.749059 nsw49-adsl-062.tpgi.com.au.1049 > f411.mail.yahoo.com.www: . ack 2920 win 8760 (DF)
14:32:44.763495 10.163.111.203.syd.ntt.net.au.3745 > nsw49-adsl-062.tpgi.com.au.ssh: . ack 64 win 64128 (DF)
14:32:44.866311 f411.mail.yahoo.com.www > nsw49-adsl-062.tpgi.com.au.1049: . 2920:4380(1460) ack 1 win 8760 (DF)
14:32:44.866476 f411.mail.yahoo.com.www > nsw49-adsl-062.tpgi.com.au.1049: P 4380:4388(8) ack 1 win 8760 (DF)
14:32:44.868599 nsw49-adsl-062.tpgi.com.au.1049 > f411.mail.yahoo.com.www: . ack 4388 win 8760 (DF)
14:32:44.922498 f411.mail.yahoo.com.www > nsw49-adsl-062.tpgi.com.au.1049: . 4388:5848(1460) ack 1 win 8760 (DF)
14:32:44.923967 dns-ntc-ti02.proxy.aol.com.32807 > nsw49-adsl-062.tpgi.com.au.domain:  38283 [1au] A? wmass.indymedia.org. (48) (DF)
14:32:44.936288 nsw49-adsl-062.tpgi.com.au.domain > dns-ntc-ti02.proxy.aol.com.32807:  38283*- 1/13/14 CNAME[|domain] (DF)
14:32:44.991606 f411.mail.yahoo.com.www > nsw49-adsl-062.tpgi.com.au.1049: P 5848:7054(1206) ack 1 win 8760 (DF)
14:32:44.993570 nsw49-adsl-062.tpgi.com.au.1049 > f411.mail.yahoo.com.www: . ack 7054 win 8760 (DF)
14:32:45.271898 ns4.on.net.domain > nsw49-adsl-062.tpgi.com.au.domain:  28339 [1au] A? images.indymedia.org. (49)
14:32:45.283482 nsw49-adsl-062.tpgi.com.au.domain > ns4.on.net.domain:  28339*- 1/13/14 CNAME[|domain] (DF)
14:32:47.887439 www.airnet.com.au.1543 > nsw49-adsl-062.tpgi.com.au.domain:  28803 [1au] A6? BLACK.CAT.ORG.AU. (45)
14:32:47.890130 nsw49-adsl-062.tpgi.com.au.domain > www.airnet.com.au.1543:  28803*- 0/1/1 (93) (DF)
14:32:49.750703 ns94.attbi.com.domain > nsw49-adsl-062.tpgi.com.au.domain:  47732 A? italy.indymedia.org. (37) (DF)
14:32:49.755328 nsw49-adsl-062.tpgi.com.au.domain > ns94.attbi.com.domain:  47732*- 1/3/3 A italy.indymedia.org (187) (DF)
14:32:50.691750 bgl1lgn-a-fixed.sancharnet.in.1055 > nsw49-adsl-062.tpgi.com.au.domain:  55279 [1au] A? germany.indymedia.org. (50)
14:32:50.697551 nsw49-adsl-062.tpgi.com.au.domain > bgl1lgn-a-fixed.sancharnet.in.1055:  55279*- 3/3/4 A[|domain] (DF)
14:32:50.769599 ns3.csu.net.14634 > nsw49-adsl-062.tpgi.com.au.domain:  3173 [1au] AAAA? BLACK.CAT.ORG.AU. (45) (DF)
14:32:50.772217 nsw49-adsl-062.tpgi.com.au.domain > ns3.csu.net.14634:  3173*- 0/1/1 (93) (DF)
14:32:50.774769 ns3.csu.net.14634 > nsw49-adsl-062.tpgi.com.au.domain:  46802 [1au] A6? BLACK.CAT.ORG.AU. (45) (DF)
14:32:50.777131 nsw49-adsl-062.tpgi.com.au.domain > ns3.csu.net.14634:  46802*- 0/1/1 (93) (DF)
14:32:55.483984 argus.cso.uiuc.edu.57847 > nsw49-adsl-062.tpgi.com.au.domain:  51156 [1au] A6? black.cat.org.au. (45)
14:32:55.486641 nsw49-adsl-062.tpgi.com.au.domain > argus.cso.uiuc.edu.57847:  51156*- 0/1/1 (93) (DF)
14:32:55.488752 argus.cso.uiuc.edu.57847 > nsw49-adsl-062.tpgi.com.au.domain:  65231 [1au] AAAA? conway.CAT.ORG.AU. (46)
14:32:55.491109 nsw49-adsl-062.tpgi.com.au.domain > argus.cso.uiuc.edu.57847:  65231*- 0/1/1 (94) (DF)
14:32:55.493578 argus.cso.uiuc.edu.57847 > nsw49-adsl-062.tpgi.com.au.domain:  62707 [1au] A6? conway.CAT.ORG.AU. (46)
14:32:55.495950 nsw49-adsl-062.tpgi.com.au.domain > argus.cso.uiuc.edu.57847:  62707*- 0/1/1 (94) (DF)
14:32:55.498561 argus.cso.uiuc.edu.57847 > nsw49-adsl-062.tpgi.com.au.domain:  23160 [1au] AAAA? diesel.CAT.ORG.AU. (46)
14:32:55.500892 nsw49-adsl-062.tpgi.com.au.domain > argus.cso.uiuc.edu.57847:  23160*- 0/1/1 (87) (DF)
14:32:55.503738 argus.cso.uiuc.edu.57847 > nsw49-adsl-062.tpgi.com.au.domain:  21606 [1au] A6? diesel.CAT.ORG.AU. (46)
14:32:55.506078 nsw49-adsl-062.tpgi.com.au.domain > argus.cso.uiuc.edu.57847:  21606*- 0/1/1 (87) (DF)
14:32:55.508661 argus.cso.uiuc.edu.57847 > nsw49-adsl-062.tpgi.com.au.domain:  51401 [1au] A6? black.cat.org.au. (45)
14:32:55.511011 nsw49-adsl-062.tpgi.com.au.domain > argus.cso.uiuc.edu.57847:  51401*- 0/1/1 (93) (DF)
14:32:55.776964 cyclops.cso.uiuc.edu.52019 > nsw49-adsl-062.tpgi.com.au.domain:  30636 [1au] AAAA? urbana.indymedia.org. (49)
14:32:55.779541 nsw49-adsl-062.tpgi.com.au.domain > cyclops.cso.uiuc.edu.52019:  30636*- 0/1/1 (96) (DF)
14:32:56.619890 great.plains.net.10336 > nsw49-adsl-062.tpgi.com.au.domain:  35805 [1au] A? www.indymedia.org. (46)
14:32:56.626890 nsw49-adsl-062.tpgi.com.au.domain > great.plains.net.10336:  35805*- 2/3/4 CNAME indymedia.org., (210) (DF)
14:32:57.257862 mec10.bigpond.net.au.domain > nsw49-adsl-062.tpgi.com.au.domain:  1060 A? www.radio.indymedia.org. (41) (DF)
14:32:57.263219 nsw49-adsl-062.tpgi.com.au.domain > mec10.bigpond.net.au.domain:  1060*- 3/3/3 CNAME[|domain] (DF)
14:32:57.264240 conway.cat.org.au.32768 > nsw49-adsl-062.tpgi.com.au.domain:  44977 SOA? creaction.org.au. (34) (DF)
14:32:57.268056 nsw49-adsl-062.tpgi.com.au.domain > conway.cat.org.au.32768:  44977*- 1/3/2 SOA[|domain] (DF)
14:32:57.665370 mambo1.nus.edu.sg.1559 > nsw49-adsl-062.tpgi.com.au.domain:  21316 [1au] A? boston.indymedia.org. (49)
14:32:57.670252 nsw49-adsl-062.tpgi.com.au.domain > mambo1.nus.edu.sg.1559:  21316*- 2/3/4 CNAME[|domain] (DF)
14:33:00.466476 golden.plains.net.19432 > nsw49-adsl-062.tpgi.com.au.domain:  53618 [1au] A? images.indymedia.org. (49)
14:33:00.478585 nsw49-adsl-062.tpgi.com.au.domain > golden.plains.net.19432:  53618*- 1/13/14 CNAME[|domain] (DF)
14:33:02.089513 ns1.uva.es.58371 > nsw49-adsl-062.tpgi.com.au.domain:  26431 [1au] A? barcelona.indymedia.org. (52) (DF)
14:33:02.094794 nsw49-adsl-062.tpgi.com.au.domain > ns1.uva.es.58371:  26431*- 2/3/4 CNAME[|domain] (DF)
14:33:02.554973 ns1.uva.es.58371 > nsw49-adsl-062.tpgi.com.au.domain:  23964 [1au] A? stallman.indymedia.org. (51) (DF)
14:33:02.559154 nsw49-adsl-062.tpgi.com.au.domain > ns1.uva.es.58371:  23964*- 1/3/4 A[|domain] (DF)
14:33:03.815559 rzeszow.intertele.pl.1340 > nsw49-adsl-062.tpgi.com.au.domain:  34070 [1au] A? italy.indymedia.org. (48)
14:33:03.821161 nsw49-adsl-062.tpgi.com.au.domain > rzeszow.intertele.pl.1340:  34070*- 1/3/4 A italy.indymedia.org (198) (DF)
14:33:08.759825 nsint2.law9.hotmail.com.1053 > nsw49-adsl-062.tpgi.com.au.domain:  27402 MX? vancouver.indymedia.org. (41)
14:33:08.765304 nsw49-adsl-062.tpgi.com.au.domain > nsint2.law9.hotmail.com.1053:  27402*- 2/3/4 CNAME[|domain] (DF)
14:33:14.098343 200.69.3.1.domain > nsw49-adsl-062.tpgi.com.au.domain:  23231 [1au] A? indymedia.org. (42) (DF)
14:33:14.104110 nsw49-adsl-062.tpgi.com.au.domain > 200.69.3.1.domain:  23231*- 1/3/4 A stallman.indymedia.org (192) (DF)
14:33:15.795839 nsw49-adsl-062.tpgi.com.au.1049 > f411.mail.yahoo.com.www: . 1:1461(1460) ack 7054 win 8760 (DF)
14:33:15.798461 nsw49-adsl-062.tpgi.com.au.1049 > f411.mail.yahoo.com.www: P 1461:1634(173) ack 7054 win 8760 (DF)
14:33:16.082826 f411.mail.yahoo.com.www > nsw49-adsl-062.tpgi.com.au.1049: . ack 1461 win 11680 (DF)
14:33:16.083874 nsw49-adsl-062.tpgi.com.au.1049 > f411.mail.yahoo.com.www: P 1634:1916(282) ack 7054 win 8760 (DF)
14:33:16.124432 f411.mail.yahoo.com.www > nsw49-adsl-062.tpgi.com.au.1049: . ack 1634 win 11680 (DF)
14:33:16.210437 f411.mail.yahoo.com.www > nsw49-adsl-062.tpgi.com.au.1049: . ack 1916 win 11680 (DF)
14:33:16.417479 dns-wl02.proxy.aol.com.32801 > nsw49-adsl-062.tpgi.com.au.domain:  14845 [1au] A? www.indymedia.org. (46) (DF)
14:33:16.423647 nsw49-adsl-062.tpgi.com.au.domain > dns-wl02.proxy.aol.com.32801:  14845*- 2/3/4 CNAME indymedia.org., (210) (DF)
14:33:16.916197 f411.mail.yahoo.com.www > nsw49-adsl-062.tpgi.com.au.1049: . 7054:8514(1460) ack 1916 win 11680 (DF)
14:33:16.969174 f411.mail.yahoo.com.www > nsw49-adsl-062.tpgi.com.au.1049: . 8514:9974(1460) ack 1916 win 11680 (DF)
14:33:16.971170 nsw49-adsl-062.tpgi.com.au.1049 > f411.mail.yahoo.com.www: . ack 9974 win 8760 (DF)
14:33:17.116764 f411.mail.yahoo.com.www > nsw49-adsl-062.tpgi.com.au.1049: . 9974:11434(1460) ack 1916 win 11680 (DF)
14:33:17.169737 f411.mail.yahoo.com.www > nsw49-adsl-062.tpgi.com.au.1049: . 11434:12894(1460) ack 1916 win 11680 (DF)
14:33:17.171893 nsw49-adsl-062.tpgi.com.au.1049 > f411.mail.yahoo.com.www: . ack 12894 win 8760 (DF)
14:33:17.174640 f411.mail.yahoo.com.www > nsw49-adsl-062.tpgi.com.au.1049: P 12894:13021(127) ack 1916 win 11680 (DF)
14:33:17.340512 nsw49-adsl-062.tpgi.com.au.1049 > f411.mail.yahoo.com.www: . ack 13021 win 8633 (DF)
14:33:17.931309 ns3.junction.net.1195 > nsw49-adsl-062.tpgi.com.au.domain:  47451 A? mail.indymedia.org. (36)
14:33:17.936425 nsw49-adsl-062.tpgi.com.au.domain > ns3.junction.net.1195:  47451*- 2/3/3 CNAME[|domain] (DF)
14:33:26.311195 buffnet11.buffnet.net.4119 > nsw49-adsl-062.tpgi.com.au.domain:  52681 A? images.indymedia.org. (38)
14:33:26.322574 nsw49-adsl-062.tpgi.com.au.domain > buffnet11.buffnet.net.4119:  52681*- 1/13/13 CNAME[|domain] (DF)
14:33:28.789036 ns2.aleron.net.58898 > nsw49-adsl-062.tpgi.com.au.domain:  20013 [1au] AAAA? black.cat.org.au. (45) (DF)
14:33:28.791787 nsw49-adsl-062.tpgi.com.au.domain > ns2.aleron.net.58898:  20013*- 0/1/1 (93) (DF)
14:33:28.867156 ns2.aleron.net.58898 > nsw49-adsl-062.tpgi.com.au.domain:  48901 [1au] A? stallman.indymedia.org. (51) (DF)
14:33:28.871337 nsw49-adsl-062.tpgi.com.au.domain > ns2.aleron.net.58898:  48901*- 1/3/4 A[|domain] (DF)
14:33:29.118976 mx03.covadmail.net.39854 > nsw49-adsl-062.tpgi.com.au.domain:  14772 [1au] A? sarai.indymedia.org. (48) (DF) [tos 0x20] 
14:33:29.124633 nsw49-adsl-062.tpgi.com.au.domain > mx03.covadmail.net.39854:  14772*- 1/3/4 A og.serve.com (198) (DF)
14:33:31.288757 mailgate.cesmail.net.2289 > nsw49-adsl-062.tpgi.com.au.domain:  40601 MX? lists.indymedia.org. (37) (DF)
14:33:31.294902 nsw49-adsl-062.tpgi.com.au.domain > mailgate.cesmail.net.2289:  40601*- 3/3/3 MX[|domain] (DF)
14:33:32.678472 si3002.inktomisearch.com.54691 > nsw49-adsl-062.tpgi.com.au.domain:  47508 A? www.russia.indymedia.org. (42) (DF)
14:33:32.690068 nsw49-adsl-062.tpgi.com.au.domain > si3002.inktomisearch.com.54691:  47508*- 2/13/13 CNAME[|domain] (DF)
14:33:33.782701 arp who-has nsw49-adsl-061.tpgi.com.au tell nsw49-adsl-062.tpgi.com.au
14:33:33.808149 arp reply nsw49-adsl-061.tpgi.com.au is-at 0:60:38:ec:c0:18
14:33:34.540268 tenerus.speakeasy.org.61417 > nsw49-adsl-062.tpgi.com.au.domain:  25630 AAAA? belgium.indymedia.org. (39) (DF)
14:33:34.543252 nsw49-adsl-062.tpgi.com.au.domain > tenerus.speakeasy.org.61417:  25630*- 1/1/0 CNAME[|domain] (DF)
14:33:39.612197 144.135.8.150.www > nsw49-adsl-062.tpgi.com.au.1048: F 575893971:575893971(0) ack 2683697 win 6432 (DF)
14:33:39.612959 nsw49-adsl-062.tpgi.com.au.1048 > 144.135.8.150.www: . ack 1 win 8494 (DF)
14:33:42.701568 hhtr7018.netvigator.com.8207 > nsw49-adsl-062.tpgi.com.au.domain:  710 [1au] A6? conway.cat.org.au. (46) (DF)
14:33:42.704873 nsw49-adsl-062.tpgi.com.au.domain > hhtr7018.netvigator.com.8207:  710*- 0/1/1 (94) (DF)
14:33:44.678410 nsw49-adsl-062.tpgi.com.au.1048 > 144.135.8.150.www: F 1:1(0) ack 1 win 8494 (DF)
14:33:44.703364 nsw49-adsl-062.tpgi.com.au.1049 > f411.mail.yahoo.com.www: . 1916:3376(1460) ack 13021 win 8633 (DF)
14:33:44.706083 nsw49-adsl-062.tpgi.com.au.1049 > f411.mail.yahoo.com.www: P 3376:3532(156) ack 13021 win 8633 (DF)
14:33:44.707236 nsw49-adsl-062.tpgi.com.au.1049 > f411.mail.yahoo.com.www: P 3532:4992(1460) ack 13021 win 8633 (DF)
14:33:44.709770 nsw49-adsl-062.tpgi.com.au.1049 > f411.mail.yahoo.com.www: P 4992:6023(1031) ack 13021 win 8633 (DF)
14:33:44.783287 nsw49-adsl-062.tpgi.com.au.1049 > f411.mail.yahoo.com.www: . 6023:7483(1460) ack 13021 win 8633 (DF)
14:33:44.786016 nsw49-adsl-062.tpgi.com.au.1049 > f411.mail.yahoo.com.www: . 7483:8943(1460) ack 13021 win 8633 (DF)
14:33:44.788721 nsw49-adsl-062.tpgi.com.au.1049 > f411.mail.yahoo.com.www: . 8943:10403(1460) ack 13021 win 8633 (DF)
14:33:44.791366 nsw49-adsl-062.tpgi.com.au.1049 > f411.mail.yahoo.com.www: . 10403:11863(1460) ack 13021 win 8633 (DF)
14:33:44.841547 144.135.8.150.www > nsw49-adsl-062.tpgi.com.au.1048: . ack 2 win 6432 (DF)
14:33:44.940802 f411.mail.yahoo.com.www > nsw49-adsl-062.tpgi.com.au.1049: . ack 3376 win 14600 (DF)
14:33:44.942884 nsw49-adsl-062.tpgi.com.au.1049 > f411.mail.yahoo.com.www: . 11863:13323(1460) ack 13021 win 8633 (DF)
14:33:44.945557 nsw49-adsl-062.tpgi.com.au.1049 > f411.mail.yahoo.com.www: P 13323:14215(892) ack 13021 win 8633 (DF)
14:33:44.970652 f411.mail.yahoo.com.www > nsw49-adsl-062.tpgi.com.au.1049: . ack 3532 win 14600 (DF)
14:33:45.185969 f411.mail.yahoo.com.www > nsw49-adsl-062.tpgi.com.au.1049: . ack 4992 win 17520 (DF)
14:33:45.340014 f411.mail.yahoo.com.www > nsw49-adsl-062.tpgi.com.au.1049: . ack 6023 win 20440 (DF)
14:33:45.354120 nsw49-adsl-062.tpgi.com.au.1049 > f411.mail.yahoo.com.www: . 14215:15675(1460) ack 13021 win 8633 (DF)
14:33:45.356843 nsw49-adsl-062.tpgi.com.au.1049 > f411.mail.yahoo.com.www: . 15675:17135(1460) ack 13021 win 8633 (DF)
14:33:45.359590 nsw49-adsl-062.tpgi.com.au.1049 > f411.mail.yahoo.com.www: . 17135:18595(1460) ack 13021 win 8633 (DF)
14:33:45.362233 nsw49-adsl-062.tpgi.com.au.1049 > f411.mail.yahoo.com.www: . 18595:20055(1460) ack 13021 win 8633 (DF)
14:33:45.364906 nsw49-adsl-062.tpgi.com.au.1049 > f411.mail.yahoo.com.www: . 20055:21515(1460) ack 13021 win 8633 (DF)
14:33:45.547182 f411.mail.yahoo.com.www > nsw49-adsl-062.tpgi.com.au.1049: . ack 7483 win 23360 (DF)
14:33:45.548721 nsw49-adsl-062.tpgi.com.au.1049 > f411.mail.yahoo.com.www: P 21515:22407(892) ack 13021 win 8633 (DF)
14:33:45.760823 f411.mail.yahoo.com.www > nsw49-adsl-062.tpgi.com.au.1049: . ack 8943 win 26280 (DF)
14:33:45.785826 amsns00.chello.com.32770 > nsw49-adsl-062.tpgi.com.au.domain:  41395 [1au] MX? lists.indymedia.org. (48) (DF)
14:33:45.792529 nsw49-adsl-062.tpgi.com.au.domain > amsns00.chello.com.32770:  41395*- 3/3/4 MX[|domain] (DF)
14:33:45.971283 f411.mail.yahoo.com.www > nsw49-adsl-062.tpgi.com.au.1049: . ack 10403 win 29200 (DF)
14:33:46.183437 f411.mail.yahoo.com.www > nsw49-adsl-062.tpgi.com.au.1049: . ack 11863 win 32120 (DF)
14:33:46.395348 f411.mail.yahoo.com.www > nsw49-adsl-062.tpgi.com.au.1049: . ack 13323 win 35040 (DF)
14:33:46.534113 f411.mail.yahoo.com.www > nsw49-adsl-062.tpgi.com.au.1049: . ack 14215 win 35040 (DF)
14:33:46.536824 nsw49-adsl-062.tpgi.com.au.1049 > f411.mail.yahoo.com.www: . 22407:23867(1460) ack 13021 win 8633 (DF)
14:33:46.539558 nsw49-adsl-062.tpgi.com.au.1049 > f411.mail.yahoo.com.www: . 23867:25327(1460) ack 13021 win 8633 (DF)
14:33:46.542320 nsw49-adsl-062.tpgi.com.au.1049 > f411.mail.yahoo.com.www: . 25327:26787(1460) ack 13021 win 8633 (DF)
14:33:46.545063 nsw49-adsl-062.tpgi.com.au.1049 > f411.mail.yahoo.com.www: . 26787:28247(1460) ack 13021 win 8633 (DF)
14:33:46.547708 nsw49-adsl-062.tpgi.com.au.1049 > f411.mail.yahoo.com.www: . 28247:29707(1460) ack 13021 win 8633 (DF)
14:33:46.550351 nsw49-adsl-062.tpgi.com.au.1049 > f411.mail.yahoo.com.www: P 29707:30599(892) ack 13021 win 8633 (DF)
14:33:46.748188 f411.mail.yahoo.com.www > nsw49-adsl-062.tpgi.com.au.1049: . ack 15675 win 35040 (DF)
14:33:46.996275 f411.mail.yahoo.com.www > nsw49-adsl-062.tpgi.com.au.1049: . ack 17135 win 35040 (DF)
14:33:47.296430 f411.mail.yahoo.com.www > nsw49-adsl-062.tpgi.com.au.1049: . ack 18595 win 35040 (DF)
14:33:47.635995 f411.mail.yahoo.com.www > nsw49-adsl-062.tpgi.com.au.1049: . ack 18595 win 35040 <nop,nop,sack sack 1 {20055:21515} > (DF)
14:33:47.750320 f411.mail.yahoo.com.www > nsw49-adsl-062.tpgi.com.au.1049: . ack 18595 win 35040 <nop,nop,sack sack 1 {20055:22407} > (DF)
14:33:47.752322 nsw49-adsl-062.tpgi.com.au.1049 > f411.mail.yahoo.com.www: . 18595:20055(1460) ack 13021 win 8633 (DF)
14:33:48.010269 f411.mail.yahoo.com.www > nsw49-adsl-062.tpgi.com.au.1049: . ack 18595 win 35040 <nop,nop,sack sack 1 {20055:23867} > (DF)
14:33:48.209079 f411.mail.yahoo.com.www > nsw49-adsl-062.tpgi.com.au.1049: . ack 18595 win 35040 <nop,nop,sack sack 1 {20055:25327} > (DF)
14:33:48.440738 f411.mail.yahoo.com.www > nsw49-adsl-062.tpgi.com.au.1049: . ack 18595 win 35040 <nop,nop,sack sack 1 {20055:26787} > (DF)
14:33:48.644509 f411.mail.yahoo.com.www > nsw49-adsl-062.tpgi.com.au.1049: . ack 18595 win 35040 <nop,nop,sack sack 1 {20055:28247} > (DF)
14:33:48.899770 f411.mail.yahoo.com.www > nsw49-adsl-062.tpgi.com.au.1049: . ack 18595 win 35040 <nop,nop,sack sack 1 {20055:29707} > (DF)
14:33:49.038993 f411.mail.yahoo.com.www > nsw49-adsl-062.tpgi.com.au.1049: . ack 18595 win 35040 <nop,nop,sack sack 1 {20055:30599} > (DF)
14:33:49.494357 bzzzt.fix.no.4905 > nsw49-adsl-062.tpgi.com.au.domain:  8895 [1au] AAAA? sarai.indymedia.org. (48)
14:33:49.497595 nsw49-adsl-062.tpgi.com.au.domain > bzzzt.fix.no.4905:  8895*- 0/1/1 (95) (DF)
14:33:49.989650 dnsspo2.att.net.br.32777 > nsw49-adsl-062.tpgi.com.au.domain:  18778 [1au] A? www.midiaindependente.org. (54) (DF)
14:33:50.000570 nsw49-adsl-062.tpgi.com.au.domain > dnsspo2.att.net.br.32777:  18778- 0/13/14 (473) (DF)
14:33:50.512892 nsw49-adsl-062.tpgi.com.au.1049 > f411.mail.yahoo.com.www: . 18595:20055(1460) ack 13021 win 8633 (DF)
14:33:53.410131 ns3.siteprotect.com.8285 > nsw49-adsl-062.tpgi.com.au.domain:  11641 AAAA? indymedia.org. (31)
14:33:53.412545 nsw49-adsl-062.tpgi.com.au.domain > ns3.siteprotect.com.8285:  11641*- 0/1/0 (78) (DF)
14:33:54.856288 ns1.jaring.my.62057 > nsw49-adsl-062.tpgi.com.au.domain:  50741 [1au] A? indymedia.org. (42)
14:33:54.860632 nsw49-adsl-062.tpgi.com.au.domain > ns1.jaring.my.62057:  50741*- 1/3/4 A stallman.indymedia.org (192) (DF)
14:33:55.401347 ns2.acld.clix.net.nz.32859 > nsw49-adsl-062.tpgi.com.au.domain:  7163 [1au] A? melbourne.indymedia.org. (52) (DF)
14:33:55.406373 nsw49-adsl-062.tpgi.com.au.domain > ns2.acld.clix.net.nz.32859:  7163*- 2/3/4 CNAME[|domain] (DF)
14:33:55.990701 argus.cso.uiuc.edu.57847 > nsw49-adsl-062.tpgi.com.au.domain:  23160 AAAA? diesel.CAT.ORG.AU. (35)
14:33:55.993184 nsw49-adsl-062.tpgi.com.au.domain > argus.cso.uiuc.edu.57847:  23160*- 0/1/0 (76) (DF)
14:33:56.134805 nsw49-adsl-062.tpgi.com.au.1049 > f411.mail.yahoo.com.www: . 18595:20055(1460) ack 13021 win 8633 (DF)
14:33:56.216163 207.66.108.17.domain > nsw49-adsl-062.tpgi.com.au.domain:  63915 A? seattle.indymedia.org. (39)
14:33:56.220362 nsw49-adsl-062.tpgi.com.au.domain > 207.66.108.17.domain:  63915*- 1/3/3 A[|domain] (DF)
14:33:56.419892 f411.mail.yahoo.com.www > nsw49-adsl-062.tpgi.com.au.1049: . ack 30599 win 35040 (DF)
14:33:56.422564 nsw49-adsl-062.tpgi.com.au.1049 > f411.mail.yahoo.com.www: . 30599:32059(1460) ack 13021 win 8633 (DF)
14:33:56.425274 nsw49-adsl-062.tpgi.com.au.1049 > f411.mail.yahoo.com.www: . 32059:33519(1460) ack 13021 win 8633 (DF)
14:33:56.690035 195.146.51.10.1034 > nsw49-adsl-062.tpgi.com.au.domain:  9142 A? images.indymedia.org. (38)
14:33:56.701454 nsw49-adsl-062.tpgi.com.au.domain > 195.146.51.10.1034:  9142*- 1/13/13 CNAME[|domain] (DF)
14:33:56.706256 f411.mail.yahoo.com.www > nsw49-adsl-062.tpgi.com.au.1049: . ack 32059 win 35040 (DF)
14:33:56.708331 nsw49-adsl-062.tpgi.com.au.1049 > f411.mail.yahoo.com.www: . 33519:34979(1460) ack 13021 win 8633 (DF)
14:33:56.714624 195.146.51.10.1034 > nsw49-adsl-062.tpgi.com.au.domain:  7101 A? italy.indymedia.org. (37)
14:33:56.718656 nsw49-adsl-062.tpgi.com.au.domain > 195.146.51.10.1034:  7101*- 1/3/3 A italy.indymedia.org (187) (DF)
14:33:56.925004 f411.mail.yahoo.com.www > nsw49-adsl-062.tpgi.com.au.1049: . ack 33519 win 35040 (DF)
14:33:56.926999 nsw49-adsl-062.tpgi.com.au.1049 > f411.mail.yahoo.com.www: . 34979:36439(1460) ack 13021 win 8633 (DF)
14:33:57.211617 f411.mail.yahoo.com.www > nsw49-adsl-062.tpgi.com.au.1049: . ack 34979 win 35040 (DF)
14:33:57.213688 nsw49-adsl-062.tpgi.com.au.1049 > f411.mail.yahoo.com.www: . 36439:37899(1460) ack 13021 win 8633 (DF)
14:33:57.216367 nsw49-adsl-062.tpgi.com.au.1049 > f411.mail.yahoo.com.www: P 37899:39359(1460) ack 13021 win 8633 (DF)
14:33:57.473534 f411.mail.yahoo.com.www > nsw49-adsl-062.tpgi.com.au.1049: . ack 36439 win 35040 (DF)
14:33:57.475576 nsw49-adsl-062.tpgi.com.au.1049 > f411.mail.yahoo.com.www: . 39359:40819(1460) ack 13021 win 8633 (DF)
14:33:57.667169 f411.mail.yahoo.com.www > nsw49-adsl-062.tpgi.com.au.1049: . ack 37899 win 35040 (DF)
14:33:57.669141 nsw49-adsl-062.tpgi.com.au.1049 > f411.mail.yahoo.com.www: . 40819:42279(1460) ack 13021 win 8633 (DF)
14:33:57.879111 f411.mail.yahoo.com.www > nsw49-adsl-062.tpgi.com.au.1049: . ack 39359 win 35040 (DF)
14:33:57.881217 nsw49-adsl-062.tpgi.com.au.1049 > f411.mail.yahoo.com.www: . 42279:43739(1460) ack 13021 win 8633 (DF)
14:33:57.883926 nsw49-adsl-062.tpgi.com.au.1049 > f411.mail.yahoo.com.www: . 43739:45199(1460) ack 13021 win 8633 (DF)
14:33:58.109446 f411.mail.yahoo.com.www > nsw49-adsl-062.tpgi.com.au.1049: . ack 40819 win 35040 (DF)
14:33:58.111420 nsw49-adsl-062.tpgi.com.au.1049 > f411.mail.yahoo.com.www: . 45199:46659(1460) ack 13021 win 8633 (DF)
14:33:58.147480 hook.nci.uni-weimar.de.32784 > nsw49-adsl-062.tpgi.com.au.domain:  33072 A? indymedia.org. (31) (DF)
14:33:58.151743 nsw49-adsl-062.tpgi.com.au.domain > hook.nci.uni-weimar.de.32784:  33072*- 1/3/3 A stallman.indymedia.org (181) (DF)
14:33:58.306685 sun00tys.tys.bellsouth.net.32769 > nsw49-adsl-062.tpgi.com.au.domain:  39189 [1au] AAAA? BLACK.CAT.ORG.AU. (45) (DF)
14:33:58.309324 nsw49-adsl-062.tpgi.com.au.domain > sun00tys.tys.bellsouth.net.32769:  39189*- 0/1/1 (93) (DF)
14:33:58.309814 f411.mail.yahoo.com.www > nsw49-adsl-062.tpgi.com.au.1049: . ack 42279 win 35040 (DF)
14:33:58.311852 nsw49-adsl-062.tpgi.com.au.1049 > f411.mail.yahoo.com.www: P 46659:48119(1460) ack 13021 win 8633 (DF)
14:33:58.518524 f411.mail.yahoo.com.www > nsw49-adsl-062.tpgi.com.au.1049: . ack 43739 win 35040 (DF)
14:33:58.520512 nsw49-adsl-062.tpgi.com.au.1049 > f411.mail.yahoo.com.www: . 48119:49579(1460) ack 13021 win 8633 (DF)
14:33:58.728703 f411.mail.yahoo.com.www > nsw49-adsl-062.tpgi.com.au.1049: . ack 45199 win 35040 (DF)
14:33:58.730698 nsw49-adsl-062.tpgi.com.au.1049 > f411.mail.yahoo.com.www: . 49579:51039(1460) ack 13021 win 8633 (DF)
14:33:58.935739 f411.mail.yahoo.com.www > nsw49-adsl-062.tpgi.com.au.1049: . ack 46659 win 35040 (DF)
14:33:58.937788 nsw49-adsl-062.tpgi.com.au.1049 > f411.mail.yahoo.com.www: . 51039:52499(1460) ack 13021 win 8633 (DF)
14:33:58.940468 nsw49-adsl-062.tpgi.com.au.1049 > f411.mail.yahoo.com.www: . 52499:53959(1460) ack 13021 win 8633 (DF)
14:33:59.227376 f411.mail.yahoo.com.www > nsw49-adsl-062.tpgi.com.au.1049: . ack 48119 win 35040 (DF)
14:33:59.229168 nsw49-adsl-062.tpgi.com.au.1049 > f411.mail.yahoo.com.www: P 53959:55175(1216) ack 13021 win 8633 (DF)
14:33:59.475755 f411.mail.yahoo.com.www > nsw49-adsl-062.tpgi.com.au.1049: . ack 49579 win 35040 (DF)
14:33:59.477775 nsw49-adsl-062.tpgi.com.au.1049 > f411.mail.yahoo.com.www: . 55175:56635(1460) ack 13021 win 8633 (DF)
14:33:59.770705 f411.mail.yahoo.com.www > nsw49-adsl-062.tpgi.com.au.1049: . ack 51039 win 35040 (DF)
14:33:59.772740 nsw49-adsl-062.tpgi.com.au.1049 > f411.mail.yahoo.com.www: . 56635:58095(1460) ack 13021 win 8633 (DF)
14:34:00.042518 f411.mail.yahoo.com.www > nsw49-adsl-062.tpgi.com.au.1049: . ack 52499 win 35040 (DF)
14:34:00.044627 nsw49-adsl-062.tpgi.com.au.1049 > f411.mail.yahoo.com.www: . 58095:59555(1460) ack 13021 win 8633 (DF)
14:34:00.047301 nsw49-adsl-062.tpgi.com.au.1049 > f411.mail.yahoo.com.www: . 59555:61015(1460) ack 13021 win 8633 (DF)
14:34:00.237905 f411.mail.yahoo.com.www > nsw49-adsl-062.tpgi.com.au.1049: . ack 55175 win 35040 (DF)
14:34:00.239983 nsw49-adsl-062.tpgi.com.au.1049 > f411.mail.yahoo.com.www: . 61015:62475(1460) ack 13021 win 8633 (DF)
14:34:00.242692 nsw49-adsl-062.tpgi.com.au.1049 > f411.mail.yahoo.com.www: P 62475:63367(892) ack 13021 win 8633 (DF)
14:34:00.676756 f411.mail.yahoo.com.www > nsw49-adsl-062.tpgi.com.au.1049: . ack 56635 win 35040 (DF)
14:34:00.678775 nsw49-adsl-062.tpgi.com.au.1049 > f411.mail.yahoo.com.www: . 63367:64827(1460) ack 13021 win 8633 (DF)
14:34:00.896994 f411.mail.yahoo.com.www > nsw49-adsl-062.tpgi.com.au.1049: . ack 58095 win 35040 (DF)
14:34:00.898986 nsw49-adsl-062.tpgi.com.au.1049 > f411.mail.yahoo.com.www: . 64827:66287(1460) ack 13021 win 8633 (DF)
14:34:01.102541 f411.mail.yahoo.com.www > nsw49-adsl-062.tpgi.com.au.1049: . ack 59555 win 35040 (DF)
14:34:01.104547 nsw49-adsl-062.tpgi.com.au.1049 > f411.mail.yahoo.com.www: . 66287:67747(1460) ack 13021 win 8633 (DF)
14:34:01.273048 f411.mail.yahoo.com.www > nsw49-adsl-062.tpgi.com.au.1049: . ack 61015 win 35040 (DF)
14:34:01.275068 nsw49-adsl-062.tpgi.com.au.1049 > f411.mail.yahoo.com.www: . 67747:69207(1460) ack 13021 win 8633 (DF)
14:34:01.277754 nsw49-adsl-062.tpgi.com.au.1049 > f411.mail.yahoo.com.www: . 69207:70667(1460) ack 13021 win 8633 (DF)
14:34:01.405564 f411.mail.yahoo.com.www > nsw49-adsl-062.tpgi.com.au.1049: . ack 63367 win 35040 (DF)
14:34:01.407133 nsw49-adsl-062.tpgi.com.au.1049 > f411.mail.yahoo.com.www: P 70667:71559(892) ack 13021 win 8633 (DF)
14:34:01.408904 nsw49-adsl-062.tpgi.com.au.1049 > f411.mail.yahoo.com.www: . 71559:73019(1460) ack 13021 win 8633 (DF)
14:34:01.826456 f411.mail.yahoo.com.www > nsw49-adsl-062.tpgi.com.au.1049: . ack 64827 win 35040 (DF)
14:34:01.828450 nsw49-adsl-062.tpgi.com.au.1049 > f411.mail.yahoo.com.www: . 73019:74479(1460) ack 13021 win 8633 (DF)
14:34:02.040088 f411.mail.yahoo.com.www > nsw49-adsl-062.tpgi.com.au.1049: . ack 66287 win 35040 (DF)
14:34:02.042064 nsw49-adsl-062.tpgi.com.au.1049 > f411.mail.yahoo.com.www: . 74479:75939(1460) ack 13021 win 8633 (DF)
14:34:02.300245 f411.mail.yahoo.com.www > nsw49-adsl-062.tpgi.com.au.1049: . ack 67747 win 35040 (DF)
14:34:02.302208 nsw49-adsl-062.tpgi.com.au.1049 > f411.mail.yahoo.com.www: . 75939:77399(1460) ack 13021 win 8633 (DF)
14:34:02.545167 f411.mail.yahoo.com.www > nsw49-adsl-062.tpgi.com.au.1049: . ack 69207 win 35040 (DF)
14:34:02.547236 nsw49-adsl-062.tpgi.com.au.1049 > f411.mail.yahoo.com.www: . 77399:78859(1460) ack 13021 win 8633 (DF)
14:34:02.549910 nsw49-adsl-062.tpgi.com.au.1049 > f411.mail.yahoo.com.www: P 78859:79751(892) ack 13021 win 8633 (DF)
14:34:02.707583 f411.mail.yahoo.com.www > nsw49-adsl-062.tpgi.com.au.1049: . ack 71559 win 35040 (DF)
14:34:02.710244 nsw49-adsl-062.tpgi.com.au.1049 > f411.mail.yahoo.com.www: . 79751:81211(1460) ack 13021 win 8633 (DF)
14:34:03.096613 f411.mail.yahoo.com.www > nsw49-adsl-062.tpgi.com.au.1049: . ack 73019 win 35040 (DF)
14:34:03.098641 nsw49-adsl-062.tpgi.com.au.1049 > f411.mail.yahoo.com.www: . 81211:82671(1460) ack 13021 win 8633 (DF)
14:34:03.101321 nsw49-adsl-062.tpgi.com.au.1049 > f411.mail.yahoo.com.www: . 82671:84131(1460) ack 13021 win 8633 (DF)
14:34:03.315476 f411.mail.yahoo.com.www > nsw49-adsl-062.tpgi.com.au.1049: . ack 73019 win 35040 <nop,nop,sack sack 1 {74479:75939} > (DF)
14:34:03.317465 nsw49-adsl-062.tpgi.com.au.1049 > f411.mail.yahoo.com.www: . 84131:85591(1460) ack 13021 win 8633 (DF)
14:34:03.499285 f411.mail.yahoo.com.www > nsw49-adsl-062.tpgi.com.au.1049: . ack 73019 win 35040 <nop,nop,sack sack 1 {74479:77399} > (DF)
14:34:03.501261 nsw49-adsl-062.tpgi.com.au.1049 > f411.mail.yahoo.com.www: . 73019:74479(1460) ack 13021 win 8633 (DF)
14:34:03.689760 f411.mail.yahoo.com.www > nsw49-adsl-062.tpgi.com.au.1049: . ack 73019 win 35040 <nop,nop,sack sack 1 {74479:78859} > (DF)
14:34:03.691740 nsw49-adsl-062.tpgi.com.au.1049 > f411.mail.yahoo.com.www: . 85591:87051(1460) ack 13021 win 8633 (DF)
14:34:03.802567 f411.mail.yahoo.com.www > nsw49-adsl-062.tpgi.com.au.1049: . ack 73019 win 35040 <nop,nop,sack sack 1 {74479:79751} > (DF)
14:34:03.804094 nsw49-adsl-062.tpgi.com.au.1049 > f411.mail.yahoo.com.www: P 87051:87943(892) ack 13021 win 8633 (DF)
14:34:04.032765 f411.mail.yahoo.com.www > nsw49-adsl-062.tpgi.com.au.1049: . ack 73019 win 35040 <nop,nop,sack sack 1 {74479:81211} > (DF)
14:34:04.271271 f411.mail.yahoo.com.www > nsw49-adsl-062.tpgi.com.au.1049: . ack 73019 win 35040 <nop,nop,sack sack 1 {74479:82671} > (DF)
14:34:04.912099 f411.mail.yahoo.com.www > nsw49-adsl-062.tpgi.com.au.1049: . ack 82671 win 35040 (DF)
14:34:04.914602 nsw49-adsl-062.tpgi.com.au.1049 > f411.mail.yahoo.com.www: . 87943:89403(1460) ack 13021 win 8633 (DF)
14:34:04.917330 nsw49-adsl-062.tpgi.com.au.1049 > f411.mail.yahoo.com.www: . 89403:90863(1460) ack 13021 win 8633 (DF)
14:34:04.920041 nsw49-adsl-062.tpgi.com.au.1049 > f411.mail.yahoo.com.www: . 90863:92323(1460) ack 13021 win 8633 (DF)
14:34:04.922716 nsw49-adsl-062.tpgi.com.au.1049 > f411.mail.yahoo.com.www: . 92323:93783(1460) ack 13021 win 8633 (DF)
14:34:05.281718 f411.mail.yahoo.com.www > nsw49-adsl-062.tpgi.com.au.1049: . ack 82671 win 35040 <nop,nop,sack sack 1 {87051:87943} > (DF)
14:34:05.283745 nsw49-adsl-062.tpgi.com.au.1049 > f411.mail.yahoo.com.www: . 93783:95243(1460) ack 13021 win 8633 (DF)
14:34:05.468774 f411.mail.yahoo.com.www > nsw49-adsl-062.tpgi.com.au.1049: . ack 82671 win 35040 <nop,nop,sack sack 1 {87051:89403} > (DF)
14:34:05.470836 nsw49-adsl-062.tpgi.com.au.1049 > f411.mail.yahoo.com.www: . 82671:84131(1460) ack 13021 win 8633 (DF)
14:34:05.473593 nsw49-adsl-062.tpgi.com.au.1049 > f411.mail.yahoo.com.www: . 84131:85591(1460) ack 13021 win 8633 (DF)
14:34:05.476238 nsw49-adsl-062.tpgi.com.au.1049 > f411.mail.yahoo.com.www: . 85591:87051(1460) ack 13021 win 8633 (DF)
14:34:05.656001 f411.mail.yahoo.com.www > nsw49-adsl-062.tpgi.com.au.1049: . ack 82671 win 35040 <nop,nop,sack sack 1 {87051:90863} > (DF)
14:34:05.657599 nsw49-adsl-062.tpgi.com.au.1049 > f411.mail.yahoo.com.www: P 95243:96135(892) ack 13021 win 8633 (DF)
14:34:05.866217 f411.mail.yahoo.com.www > nsw49-adsl-062.tpgi.com.au.1049: . ack 82671 win 35040 <nop,nop,sack sack 1 {87051:92323} > (DF)
14:34:06.088231 f411.mail.yahoo.com.www > nsw49-adsl-062.tpgi.com.au.1049: . ack 82671 win 35040 <nop,nop,sack sack 1 {87051:93783} > (DF)
14:34:06.302102 f411.mail.yahoo.com.www > nsw49-adsl-062.tpgi.com.au.1049: . ack 82671 win 35040 <nop,nop,sack sack 1 {87051:95243} > (DF)
14:34:06.513968 f411.mail.yahoo.com.www > nsw49-adsl-062.tpgi.com.au.1049: . ack 84131 win 35040 <nop,nop,sack sack 1 {87051:95243} > (DF)
14:34:06.588775 nsw49-adsl-062.tpgi.com.au.1049 > f411.mail.yahoo.com.www: . 84131:85591(1460) ack 13021 win 8633 (DF)
14:34:06.739468 f411.mail.yahoo.com.www > nsw49-adsl-062.tpgi.com.au.1049: . ack 85591 win 35040 <nop,nop,sack sack 1 {87051:95243} > (DF)
14:34:06.741490 nsw49-adsl-062.tpgi.com.au.1049 > f411.mail.yahoo.com.www: . 85591:87051(1460) ack 13021 win 8633 (DF)
14:34:06.744196 nsw49-adsl-062.tpgi.com.au.1049 > f411.mail.yahoo.com.www: P 87051:88511(1460) ack 13021 win 8633 (DF)
14:34:06.919778 f411.mail.yahoo.com.www > nsw49-adsl-062.tpgi.com.au.1049: . ack 95243 win 35040 (DF)
14:34:06.921305 nsw49-adsl-062.tpgi.com.au.1049 > f411.mail.yahoo.com.www: P 95243:96135(892) ack 13021 win 8633 (DF)
14:34:06.923117 nsw49-adsl-062.tpgi.com.au.1049 > f411.mail.yahoo.com.www: . 96135:97595(1460) ack 13021 win 8633 (DF)
14:34:06.925824 nsw49-adsl-062.tpgi.com.au.1049 > f411.mail.yahoo.com.www: . 97595:99055(1460) ack 13021 win 8633 (DF)
14:34:07.077102 f411.mail.yahoo.com.www > nsw49-adsl-062.tpgi.com.au.1049: . ack 96135 win 35040 (DF)
14:34:07.079213 nsw49-adsl-062.tpgi.com.au.1049 > f411.mail.yahoo.com.www: . 99055:100515(1460) ack 13021 win 8633 (DF)
14:34:07.081900 nsw49-adsl-062.tpgi.com.au.1049 > f411.mail.yahoo.com.www: . 100515:101975(1460) ack 13021 win 8633 (DF)
14:34:07.280765 f411.mail.yahoo.com.www > nsw49-adsl-062.tpgi.com.au.1049: . ack 96135 win 35040 <nop,nop,sack sack 1 {84131:85591} > (DF)
14:34:07.282838 nsw49-adsl-062.tpgi.com.au.1049 > f411.mail.yahoo.com.www: . 101975:103435(1460) ack 13021 win 8633 (DF)
14:34:07.486518 f411.mail.yahoo.com.www > nsw49-adsl-062.tpgi.com.au.1049: . ack 96135 win 35040 <nop,nop,sack sack 1 {85591:87051} > (DF)
14:34:07.488493 nsw49-adsl-062.tpgi.com.au.1049 > f411.mail.yahoo.com.www: . 96135:97583(1448) ack 13021 win 8633 (DF)
14:34:07.713244 f411.mail.yahoo.com.www > nsw49-adsl-062.tpgi.com.au.1049: . ack 96135 win 35040 <nop,nop,sack sack 1 {87051:88511} > (DF)
14:34:07.715306 nsw49-adsl-062.tpgi.com.au.1049 > f411.mail.yahoo.com.www: P 103435:104895(1460) ack 13021 win 8633 (DF)
14:34:07.850733 f411.mail.yahoo.com.www > nsw49-adsl-062.tpgi.com.au.1049: . ack 96135 win 35040 <nop,nop,sack sack 1 {95243:96135} > (DF)
14:34:07.852740 nsw49-adsl-062.tpgi.com.au.1049 > f411.mail.yahoo.com.www: . 104895:106355(1460) ack 13021 win 8633 (DF)
14:34:08.077185 f411.mail.yahoo.com.www > nsw49-adsl-062.tpgi.com.au.1049: . ack 97595 win 35040 (DF)
14:34:08.097885 nsw49-adsl-062.tpgi.com.au.1049 > f411.mail.yahoo.com.www: . 97595:99055(1460) ack 13021 win 8633 (DF)
14:34:08.276501 f411.mail.yahoo.com.www > nsw49-adsl-062.tpgi.com.au.1049: . ack 99055 win 35040 (DF)
14:34:08.278501 nsw49-adsl-062.tpgi.com.au.1049 > f411.mail.yahoo.com.www: . 99055:100515(1460) ack 13021 win 8633 (DF)
14:34:08.281180 nsw49-adsl-062.tpgi.com.au.1049 > f411.mail.yahoo.com.www: . 100515:101975(1460) ack 13021 win 8633 (DF)
14:34:08.458790 f411.mail.yahoo.com.www > nsw49-adsl-062.tpgi.com.au.1049: . ack 100515 win 35040 (DF)
14:34:08.460798 nsw49-adsl-062.tpgi.com.au.1049 > f411.mail.yahoo.com.www: . 101975:103435(1460) ack 13021 win 8633 (DF)
14:34:08.463505 nsw49-adsl-062.tpgi.com.au.1049 > f411.mail.yahoo.com.www: P 103435:104895(1460) ack 13021 win 8633 (DF)
14:34:08.670742 f411.mail.yahoo.com.www > nsw49-adsl-062.tpgi.com.au.1049: . ack 101975 win 35040 (DF)
14:34:08.672773 nsw49-adsl-062.tpgi.com.au.1049 > f411.mail.yahoo.com.www: . 104895:106355(1460) ack 13021 win 8633 (DF)
14:34:08.884365 f411.mail.yahoo.com.www > nsw49-adsl-062.tpgi.com.au.1049: . ack 103435 win 35040 (DF)
14:34:08.886349 nsw49-adsl-062.tpgi.com.au.1049 > f411.mail.yahoo.com.www: . 106355:107815(1460) ack 13021 win 8633 (DF)
14:34:09.098013 f411.mail.yahoo.com.www > nsw49-adsl-062.tpgi.com.au.1049: . ack 103435 win 35040 <nop,nop,sack sack 1 {96135:97583} > (DF)
14:34:09.100085 nsw49-adsl-062.tpgi.com.au.1049 > f411.mail.yahoo.com.www: . 107815:109275(1460) ack 13021 win 8633 (DF)
14:34:09.306952 f411.mail.yahoo.com.www > nsw49-adsl-062.tpgi.com.au.1049: . ack 104895 win 35040 (DF)
14:34:09.402159 nsw49-adsl-062.tpgi.com.au.1049 > f411.mail.yahoo.com.www: . 104895:106355(1460) ack 13021 win 8633 (DF)
14:34:09.548667 f411.mail.yahoo.com.www > nsw49-adsl-062.tpgi.com.au.1049: . ack 106355 win 35040 (DF)
14:34:09.550788 nsw49-adsl-062.tpgi.com.au.1049 > f411.mail.yahoo.com.www: . 106355:107815(1460) ack 13021 win 8633 (DF)
14:34:09.553491 nsw49-adsl-062.tpgi.com.au.1049 > f411.mail.yahoo.com.www: . 107815:109275(1460) ack 13021 win 8633 (DF)
14:34:09.750735 f411.mail.yahoo.com.www > nsw49-adsl-062.tpgi.com.au.1049: . ack 106355 win 35040 <nop,nop,sack sack 1 {97595:99055} > (DF)
14:34:09.752744 nsw49-adsl-062.tpgi.com.au.1049 > f411.mail.yahoo.com.www: . 109275:110735(1460) ack 13021 win 8633 (DF)
14:34:09.964367 f411.mail.yahoo.com.www > nsw49-adsl-062.tpgi.com.au.1049: . ack 106355 win 35040 <nop,nop,sack sack 1 {99055:100515} > (DF)
14:34:09.966385 nsw49-adsl-062.tpgi.com.au.1049 > f411.mail.yahoo.com.www: . 106355:107803(1448) ack 13021 win 8633 (DF)
14:34:10.155168 f411.mail.yahoo.com.www > nsw49-adsl-062.tpgi.com.au.1049: . ack 106355 win 35040 <nop,nop,sack sack 1 {100515:101975} > (DF)
14:34:10.157139 nsw49-adsl-062.tpgi.com.au.1049 > f411.mail.yahoo.com.www: . 110735:112195(1460) ack 13021 win 8633 (DF)
14:34:10.381764 f411.mail.yahoo.com.www > nsw49-adsl-062.tpgi.com.au.1049: . ack 106355 win 35040 <nop,nop,sack sack 1 {101975:103435} > (DF)
14:34:10.383800 nsw49-adsl-062.tpgi.com.au.1049 > f411.mail.yahoo.com.www: P 112195:113655(1460) ack 13021 win 8633 (DF)
14:34:10.792518 f411.mail.yahoo.com.www > nsw49-adsl-062.tpgi.com.au.1049: . ack 106355 win 35040 <nop,nop,sack sack 1 {104895:106355} > (DF)
14:34:10.794529 nsw49-adsl-062.tpgi.com.au.1049 > f411.mail.yahoo.com.www: . 113655:115115(1460) ack 13021 win 8633 (DF)
14:34:11.029542 MANGO.SRV.CS.CMU.EDU.32779 > nsw49-adsl-062.tpgi.com.au.domain:  25 A? images.indymedia.org. (38) (DF) [tos 0x3c] 
14:34:11.032724 f411.mail.yahoo.com.www > nsw49-adsl-062.tpgi.com.au.1049: . ack 107815 win 35040 (DF)
14:34:11.041686 nsw49-adsl-062.tpgi.com.au.domain > MANGO.SRV.CS.CMU.EDU.32779:  25*- 1/13/13 CNAME[|domain] (DF)
14:34:11.106192 nsw49-adsl-062.tpgi.com.au.1049 > f411.mail.yahoo.com.www: . 107815:109275(1460) ack 13021 win 8633 (DF)
14:34:11.248057 f411.mail.yahoo.com.www > nsw49-adsl-062.tpgi.com.au.1049: . ack 109275 win 35040 (DF)
14:34:11.250089 nsw49-adsl-062.tpgi.com.au.1049 > f411.mail.yahoo.com.www: . 109275:110735(1460) ack 13021 win 8633 (DF)
14:34:11.252795 nsw49-adsl-062.tpgi.com.au.1049 > f411.mail.yahoo.com.www: . 110735:112195(1460) ack 13021 win 8633 (DF)
14:34:11.291035 65-173-40-10.nomentnoc.noment.net.32811 > nsw49-adsl-062.tpgi.com.au.domain:  38028 [1au] A? sf.indymedia.org. (45) (DF)
14:34:11.296985 nsw49-adsl-062.tpgi.com.au.domain > 65-173-40-10.nomentnoc.noment.net.32811:  38028*- 3/3/4 A UNKNOWN-64-156-215-204.yahoo.com,[|domain] (DF)
14:34:11.426991 MANGO.SRV.CS.CMU.EDU.32779 > nsw49-adsl-062.tpgi.com.au.domain:  61211 A? italy.indymedia.org. (37) (DF) [tos 0x3c] 
14:34:11.431005 nsw49-adsl-062.tpgi.com.au.domain > MANGO.SRV.CS.CMU.EDU.32779:  61211*- 1/3/3 A italy.indymedia.org (187) (DF)
14:34:11.476485 f411.mail.yahoo.com.www > nsw49-adsl-062.tpgi.com.au.1049: . ack 109275 win 35040 <nop,nop,sack sack 1 {104895:106355} > (DF)
14:34:11.478493 nsw49-adsl-062.tpgi.com.au.1049 > f411.mail.yahoo.com.www: P 112195:113655(1460) ack 13021 win 8633 (DF)
14:34:11.672160 f411.mail.yahoo.com.www > nsw49-adsl-062.tpgi.com.au.1049: . ack 109275 win 35040 <nop,nop,sack sack 1 {106355:107815} > (DF)
14:34:11.674138 nsw49-adsl-062.tpgi.com.au.1049 > f411.mail.yahoo.com.www: . 109275:110723(1448) ack 13021 win 8633 (DF)
14:34:11.867529 f411.mail.yahoo.com.www > nsw49-adsl-062.tpgi.com.au.1049: . ack 109275 win 35040 <nop,nop,sack sack 1 {107815:109275} > (DF)
14:34:11.869620 nsw49-adsl-062.tpgi.com.au.1049 > f411.mail.yahoo.com.www: . 113655:115115(1460) ack 13021 win 8633 (DF)
14:34:12.091039 f411.mail.yahoo.com.www > nsw49-adsl-062.tpgi.com.au.1049: . ack 110735 win 35040 (DF)
14:34:12.105607 nsw49-adsl-062.tpgi.com.au.1049 > f411.mail.yahoo.com.www: . 110735:112195(1460) ack 13021 win 8633 (DF)
14:34:12.315180 f411.mail.yahoo.com.www > nsw49-adsl-062.tpgi.com.au.1049: . ack 110735 win 35040 <nop,nop,sack sack 1 {106355:107803} > (DF)
14:34:12.317166 nsw49-adsl-062.tpgi.com.au.1049 > f411.mail.yahoo.com.www: P 112195:113655(1460) ack 13021 win 8633 (DF)
14:34:12.538503 f411.mail.yahoo.com.www > nsw49-adsl-062.tpgi.com.au.1049: . ack 112195 win 35040 (DF)
14:34:12.540487 nsw49-adsl-062.tpgi.com.au.1049 > f411.mail.yahoo.com.www: . 113655:115115(1460) ack 13021 win 8633 (DF)
14:34:12.748639 f411.mail.yahoo.com.www > nsw49-adsl-062.tpgi.com.au.1049: . ack 113655 win 35040 (DF)
14:34:12.750660 nsw49-adsl-062.tpgi.com.au.1049 > f411.mail.yahoo.com.www: . 115115:116575(1460) ack 13021 win 8633 (DF)
14:34:12.863041 ns1.jaring.my.62057 > nsw49-adsl-062.tpgi.com.au.domain:  17748 [1au] A? images.indymedia.org. (49)
14:34:12.874704 nsw49-adsl-062.tpgi.com.au.domain > ns1.jaring.my.62057:  17748*- 1/13/14 CNAME[|domain] (DF)
14:34:12.954188 f411.mail.yahoo.com.www > nsw49-adsl-062.tpgi.com.au.1049: . ack 115115 win 35040 (DF)
14:34:12.956206 nsw49-adsl-062.tpgi.com.au.1049 > f411.mail.yahoo.com.www: . 116575:118035(1460) ack 13021 win 8633 (DF)
14:34:13.252328 f411.mail.yahoo.com.www > nsw49-adsl-062.tpgi.com.au.1049: . ack 115115 win 35040 <nop,nop,sack sack 1 {107815:109275} > (DF)
14:34:13.254326 nsw49-adsl-062.tpgi.com.au.1049 > f411.mail.yahoo.com.www: . 118035:119495(1460) ack 13021 win 8633 (DF)
14:34:13.476031 f411.mail.yahoo.com.www > nsw49-adsl-062.tpgi.com.au.1049: . ack 115115 win 35040 <nop,nop,sack sack 1 {109275:110735} > (DF)
